{
  "schemaVersion": "1.0",
  "project": {
    "id": "atlas-commerce",
    "name": "Atlas Commerce API",
    "kind": "api",
    "version": "demo-v1",
    "description": "A synthetic order service. Trace a purchase from its consumer through validation, persistence, and a declared API response.",
    "capabilities": [
      "overview",
      "journey",
      "architecture",
      "api",
      "data",
      "work",
      "study"
    ],
    "tags": [
      "Synthetic example",
      "REST API",
      "Orders",
      "PostgreSQL"
    ]
  },
  "sources": [
    {
      "id": "commerce-journey",
      "path": "docs/journeys/place-order.md",
      "label": "Synthetic journey specification",
      "revision": "demo-v1",
      "repository": "synthetic/example-project",
      "freshness": "current"
    },
    {
      "id": "commerce-api",
      "path": "contracts/openapi.json",
      "label": "Synthetic OpenAPI contract",
      "revision": "demo-v1",
      "repository": "synthetic/example-project",
      "freshness": "current"
    },
    {
      "id": "commerce-service",
      "path": "src/orders/OrderService.ts",
      "label": "Synthetic service implementation",
      "revision": "demo-v1",
      "repository": "synthetic/example-project",
      "freshness": "current"
    },
    {
      "id": "commerce-schema",
      "path": "migrations/001_orders.sql",
      "label": "Synthetic database migration",
      "revision": "demo-v1",
      "repository": "synthetic/example-project",
      "freshness": "current"
    },
    {
      "id": "commerce-tests",
      "path": "test/orders/create-order.test.ts",
      "label": "Synthetic contract tests",
      "revision": "demo-v1",
      "repository": "synthetic/example-project",
      "freshness": "current"
    },
    {
      "id": "commerce-work",
      "path": "docs/work/order-reliability.md",
      "label": "Synthetic work records",
      "revision": "demo-v1",
      "repository": "synthetic/example-project",
      "freshness": "current"
    },
    {
      "id": "commerce-study",
      "path": "docs/study/order-failure-scenarios.md",
      "label": "Synthetic learning notes",
      "revision": "demo-v1",
      "repository": "synthetic/example-project",
      "freshness": "stale"
    }
  ],
  "nodes": [
    {
      "sourceIds": [
        "commerce-journey"
      ],
      "status": "implemented",
      "evidence": "reviewed",
      "tags": [
        "Core module"
      ],
      "id": "orders-module",
      "kind": "module",
      "label": "Orders",
      "description": "Order submission, validation, persistence, and response contracts."
    },
    {
      "sourceIds": [
        "commerce-journey"
      ],
      "status": "implemented",
      "evidence": "reviewed",
      "tags": [
        "Supporting module"
      ],
      "id": "catalog-module",
      "kind": "module",
      "label": "Catalog",
      "description": "Product availability used while validating an order."
    },
    {
      "sourceIds": [
        "commerce-journey"
      ],
      "status": "implemented",
      "evidence": "reviewed",
      "tags": [
        "Actor"
      ],
      "id": "order-consumer",
      "kind": "actor",
      "label": "API consumer",
      "description": "An authenticated application submits an order. This API-only project has no frontend pages.",
      "moduleId": "orders-module"
    },
    {
      "sourceIds": [
        "commerce-journey"
      ],
      "status": "implemented",
      "evidence": "reviewed",
      "tags": [
        "Happy path",
        "Failure path"
      ],
      "id": "place-order-journey",
      "kind": "journey",
      "label": "Place an order",
      "description": "Validate a submitted basket, persist the order, and return its identifier. Invalid stock is rejected before a write.",
      "moduleId": "orders-module"
    },
    {
      "sourceIds": [
        "commerce-api"
      ],
      "status": "verified",
      "evidence": "reviewed",
      "tags": [
        "POST",
        "/api/orders"
      ],
      "id": "create-order",
      "kind": "operation",
      "label": "Create an order",
      "moduleId": "orders-module",
      "description": "Accepts a customer reference and line items. Returns a created order or a declared validation error. The synthetic test evidence covers the contract, not deployment or UAT.",
      "details": {
        "endpoint": {
          "method": "POST",
          "path": "/api/orders",
          "authentication": "Bearer token · orders:create",
          "request": {
            "contentType": "application/json",
            "schema": {
              "type": "object",
              "required": [
                "customerId",
                "items"
              ],
              "properties": {
                "customerId": {
                  "type": "string"
                },
                "items": {
                  "type": "array",
                  "minItems": 1,
                  "items": {
                    "type": "object",
                    "required": [
                      "productId",
                      "quantity"
                    ],
                    "properties": {
                      "productId": {
                        "type": "string"
                      },
                      "quantity": {
                        "type": "integer",
                        "minimum": 1
                      }
                    }
                  }
                }
              }
            },
            "example": {
              "customerId": "customer-demo-01",
              "items": [
                {
                  "productId": "product-demo-01",
                  "quantity": 2
                }
              ]
            }
          },
          "responses": {
            "201": {
              "description": "Order created",
              "schema": {
                "type": "object",
                "required": [
                  "id",
                  "status"
                ],
                "properties": {
                  "id": {
                    "type": "string"
                  },
                  "status": {
                    "const": "created"
                  }
                }
              },
              "example": {
                "id": "order-demo-01",
                "status": "created"
              }
            },
            "400": {
              "description": "Invalid or empty basket",
              "example": {
                "code": "INVALID_ORDER",
                "message": "At least one valid line item is required."
              }
            },
            "401": {
              "description": "Authentication required",
              "example": {
                "code": "UNAUTHENTICATED"
              }
            },
            "409": {
              "description": "Insufficient stock",
              "example": {
                "code": "INSUFFICIENT_STOCK",
                "productId": "product-demo-01"
              }
            }
          }
        },
        "notes": [
          "All identifiers and examples are synthetic.",
          "A verified contract test is not business acceptance or proof of a deployed service."
        ]
      }
    },
    {
      "sourceIds": [
        "commerce-service"
      ],
      "status": "verified",
      "evidence": "reviewed",
      "tags": [
        "Validation"
      ],
      "id": "validate-order",
      "kind": "service",
      "label": "Validate basket",
      "description": "Checks nonempty line items, positive quantities, and current product availability before persisting anything.",
      "moduleId": "orders-module",
      "details": {
        "notes": [
          "Reject invalid requests before a database write.",
          "The check and reservation must share a consistent transaction boundary."
        ]
      }
    },
    {
      "sourceIds": [
        "commerce-service"
      ],
      "status": "implemented",
      "evidence": "reviewed",
      "tags": [
        "Application service"
      ],
      "id": "order-service",
      "kind": "service",
      "label": "OrderService",
      "description": "Coordinates validation and order creation within a transaction, then maps the persisted record to the public response.",
      "moduleId": "orders-module",
      "details": {
        "code": "async function createOrder(input, actor) {\n  const basket = await validateBasket(input.items);\n  return transaction(async () => {\n    const order = await orders.insert(actor.customerId, basket);\n    return { id: order.id, status: \"created\" };\n  });\n}",
        "notes": [
          "Illustrative pseudocode for this synthetic project."
        ]
      }
    },
    {
      "sourceIds": [
        "commerce-schema"
      ],
      "status": "implemented",
      "evidence": "reviewed",
      "tags": [
        "PostgreSQL"
      ],
      "id": "orders-table",
      "kind": "table",
      "label": "orders",
      "description": "Persists the order header. A separate order_items table preserves the submitted quantities.",
      "moduleId": "orders-module",
      "details": {
        "fields": [
          {
            "name": "id",
            "type": "uuid",
            "required": true,
            "primaryKey": true
          },
          {
            "name": "customer_id",
            "type": "uuid",
            "required": true
          },
          {
            "name": "status",
            "type": "varchar(24)",
            "required": true
          },
          {
            "name": "created_at",
            "type": "timestamptz",
            "required": true
          }
        ],
        "notes": [
          "Database shape is independent of the public response DTO."
        ]
      }
    },
    {
      "sourceIds": [
        "commerce-schema"
      ],
      "status": "implemented",
      "evidence": "reviewed",
      "tags": [
        "PostgreSQL"
      ],
      "id": "order-items-table",